,song_title,lyrics
49,so,im filled up with doubt i have to move home but i want to stay with you for all of the summer i have my plan that you wont remember if you want to see the world then please ask your mother i cannot hold your hand to watch you go oh i am a liar as you might know i need you now i need your touch and your lips i need your smile and your kiss cause youre so cool youre so beautiful youre so and youre so youre so cool youre so beautiful youre so and youre so hmm hmm hmmm hmmmm hmm hmm hmmm hmm i see your voice and from my window when it is late at night itll show me your shadow i have my plan that you wont remember if you want to see the world and please ask your mother now ah oh ah oh i cannot hold your hand to watch you go oh im a liar as you might know i need you now i need your touch and your lips i need that smile and your kiss cause youre so cool youre so beautiful youre so and youre so youre so cool youre so beautiful youre so and youre so and youre so cool youre so beautiful youre so and youre so hm youre so cool youre so beautiful youre so and youre so now these words i say mean you re so amazing and ive noticed lately i need you maybe these words i say mean you re so amazing but ive noticed lately i need you maybe cause youre so cool youre so beautiful youre so and youre so youre so cool youre so beautiful youre so and youre so
50,you need me i dont need you,i dont want bruise your ears or hurt you again but i got back stabbed by a black cab when i needed a friend now im in town break it down thinking of making a new sound playing a different show every night in front of a new crowd that s you now ciao seems that life is great now see me lose focus as i sing to you loud i cant no i wont hush ill say the words that make you blush im gonna sing this now see i m true my songs are where my heart is im like glue i stick to other artists im not you now that would be disastrous let me sing and do my thing and move to greener pastures see im real i do it all its all me im not fake dont ever call me lazy i wont stay put give me the chance to be free suffolk sadly seems to sort of suffocate me cause you need me man i dont need you you need me man i dont need you you need me man i dont need you at all you need me man i dont need you you need me man i dont need you you need me man i dont need you you need me man i dont need you at all you need me i sing and write my own tune and i write my own verse hell dont need another wordsmith to make my tunes sell call yourself a singer writer youre just bluffing names on the credits and you didnt write nothing i sing fast i know that all my shits cool i will blast and i didnt go to brit school i came fast with the way i act right i cant last if im smoking on a crack pipe and i wont be a product of my genre my mind will always be stronger than my songs are never believe the bullshit that fake guys feed to ya always read the stories that you hear in wikipedia and musically im demonstrating when i perform live feels like i am meditating times at the enterprise when some fella filmed me a young singer writer like a gabriella cilmi cause you need me man i don t need you you need me man i dont need you you need me man i dont need you at all you need me man i dont need you you need me man i dont need you you need me man i dont need you you need me man i dont need you at all you need me cause with the lyrics ill be aiming it right i wont stop until my names in lights with stadium heights with damien rice on red carpets now im on arabian nights because im young i know my brothers gonna give me advice long nighter short height and i gone hyper never be anything but a singer songwriter yeah the games over but now im on a new level watch how i step on the track without a loop pedal people think that im bound to blow up ive done around about a thousand shows but i havent got a house plus i live on a couch so you believe the lyrics when im singing them out wow from day one ive been prepared with v05 wax for my ginger hair so now im back to the sofa giving a dose of what the future holds cause its another day plus ill keep my last name forever keep this genre pretty basic gonna be breaking into other peoples tunes when i chase it and replace it with the elephant in the room with a facelift slipping into another rapper shoes using new laces im selling cds from my rucksack aiming for the papers selling cds from my rucksack aiming for the majors nationwide tour with just jack still had to get the bus back clean cut kid without a razor for the moustache i hit back when the pen hurts me im still a choir boy in a fenchurch tee im still the same as a year ago but more people hear me though according to the myspace and youtube videos im always doing shows if im not im in the studio truly broke never growing up call me rufio melody music maker reading all the papers they say im up and coming like im fucking in an elevator cause you need me man i dont need you you need me man i dont need you you need me man i dont need you at all you need me man i dont need you you need me man i dont need you you need me man i dont need you you need me man i dont need you at all you need me man i dont need you
51,touch and go,oh oh oh oh oh oh oh oh oh oh oh oh waking up midnight november and youre still in my bed its kinda rough cause since i met ya theres things weve never said so if i go for a little while longer when im home we can talk about the pitfalls of the road if you say go i would stop everything oh my heart would play the role now and act like its never been broke though my soul oh oh oh lately i really need to know how long how long can we be touch and go oh my soul oh oh oh how long how long can we be touch and go its not enough to say i want ya cause ill say anything im holding out to feel without a doubt i had have just been questioning it if i go for a little while longer when im home we can talk about the pitfalls of the road if you say go i would stop everything oh my heart would play the role now and act like its never been broke though my soul oh oh oh lately i really need to know how long how long can we be touch and go oh my soul oh oh oh how long how long can we be all of my bones they scream im right if youre taking me home to stay the night darling my soul would heal if you say go i would stop everything oh my heart would play the wrong and act like its never been broke though my soul lately i really need to know how long how long can we be touch and go oh my soul how long how long how long can we be touch and go how long how long can we be touch and go how long how long can we be touch and go
52,new york,ooh ooh whoa oh oh oh now now five drinks in on friday night we only came to dry your eyes and get you out of your room now this bar has closed its doors i found my hand is holding yours do you wanna go home so soon or maybe we should take a ride through the night and sing along to every song thats on the radio in the back of a taxi cab in brooklyn oh no no the sun could rise burning all the street lamps out at 3am so dj play it again until the night turns into morning youll be in my arms well just keep driving along the boulevard and if i kissed you darling please dont be alarmed its just the start of everything if you want a new love in new york yesterday gave me a call stressing out about it all said the world is moving too fast and you dont know where to begin cause youve spent a lifetime fitting in only to wind up on the other side by yourself and every day screaming out to all the people that you used to know from a window that looks upon manhattan skyline its just the way that life goes and you hear it in every song you know so dj play it again until the night turns into morning youll be in my arms well just keep driving along the boulevard and if i kissed you darling please dont be alarmed its just the start of everything if you want a new life in new york and every song that plays is just like the day you had and its okay to cry but im saying maybe thats a waste of water you know im here for you in the back of the taxi cab tonight in new york its just reached the morning and youre still in my arms and weve stopped driving down the boulevard and i just kissed you darling i hope you werent alarmed its just the start of everything that you want a new love in new york
53,make it rain,when the sins of my father weigh down in my soul and the pain of my mother will not let me go well i know there can come fire from the sky to refine the purest of kings and even though i know this fire brings me pain even so and just the same make it rain make it rain down lord make it rain oh make it rain make it rain make it rain down lord make it rain make it rain well a seed needs the water fore it grows out of the ground but it just keeps on getting hard hunger more profound well i know they cant count tears from the eye but they may as well all be in vain and even though i know these tears come with pain even so and just the same make it rain make it rain down lord make it rain oh make it rain make it rain make it rain down lord just make it rain make it rain well the seas are full of water stops by the shore its like the riches of grandeur oh no never reach the poor and let the clouds fill with thunderous applause and let lightning be the veins but fill the sky with all that they can draw when its time to make a change make it rain make it rain down lord make it rain make it rain make it rain make it rain down lord make it rain oh make it rain make it rain make it rain make it rain oh make it rain make it rain make it rain down lord make it rain oh make it rain make it rain make it rain make it rain make it rain make it rain make it rain make it rain oh make it rain
54,all of the stars,its just another night and im staring at the moon i saw a shooting star and thought of you i sang a lullaby by the waterside and knew if you were here id sing to you youre on the other side as the skyline splits in two im miles away from seeing you but i can see the stars from america i wondered do you see them too so open your eyes and see the way our horizons meet and all of the lights will lead into the night with me and i know these scars will bleed but both of our hearts believe all of these stars will guide us home i can hear your heart on the radio beat theyre playing chasing cars and i thought of us back to the time you were lying next to me i looked across and fell in love so i took your hand back through lamp lit streets i knew everything led back to you so can you see the stars over amsterdam youre the song my heart is beating to so open your eyes and see the way our horizons meet and all of the lights will lead into the night with me and i know these scars will bleed but both of our hearts believe all of these stars will guide us home and oh i know and oh i know and oh i can see the stars from america
55,i see fire,oh misty eye of the mountain below keep careful watch of my brothers souls and should the sky be filled with fire and smoke keep watching over durins sons if this is to end in fire then we should all burn together watch the flames climb high into the night calling out father oh stand by and we will watch the flames burn auburn on the mountain side and if we should die tonight we should all die together raise a glass of wine for the last time calling out father oh prepare as we will watch the flames burn auburn on the mountain side desolation comes upon the sky now i see fire inside the mountain i see fire burning the trees and i see fire hollowing souls i see fire blood in the breeze and i hope that you remember me oh should my people fall then surely ill do the same confined in mountain halls we got too close to the flame calling out father oh hold fast and we will watch the flames burn auburn on the mountain side desolation comes upon the sky now i see fire inside the mountain i see fire burning the trees and i see fire hollowing souls i see fire blood in the breeze and i hope that you remember me and if the night is burning i will cover my eyes for if the dark returns then my brothers will die and as the skys falling down it crashed into this lonely town and with that shadow upon the ground i hear my people screaming out now i see fire inside the mountain i see fire burning the trees i see fire hollowing souls i see fire blood in the breeze i see fire i see fire i see fire and i see fire burn auburn on the mountain side
56,reuf,cest pour mes frères et sœurs dune autre mère on a acquis le statut dfamille mon reuf a toujours couvert mes arrières jcontinuerai de mentir à sa petite amie ma mère peut lengueuler comme si cétait son fils sil stape je vais sauter doffice dans la mêlée même si mes habits coûtent cher cest la même même si cest lui qua cherché la merde cest vrai quil est pas réaliste jai les boules de le voir décevoir ses rents pa et perdre son temps on est trente sur la liste on déboule devant la boite yen a un qui rentre pas personne rentre jsuis le seul à te voir quand tas pas les cheveux lissés notre équipe était massive au lycée et tu le sais dans mon équipe yavait quasiment que des têtes cramées jétais celui quon envoyait pour paraître civilisés des urgences des mariages des naissances des procès des nuits blanches et des micro siestes tous mes amis en ont dans le ventre mais ça ne se voit pas comme un déni dgrossesse cest pour mes reufs les vrais pas les faux les frères pas les potes hey hey je te parle de mes reufs les vrais pas les faux les frères pas les potes hey hey je te parle de mes reufs les vrais pas les faux les frères pas les potes les traîtres on les fuck when you feel lonely know which way to go ill be calling you ill be calling you they dont even know me but when you feel alone ill be calling you ill be calling you jai passé mon adolescence à voler secrètement si je te disais que je regrette ce serait te mentir maintenant je sais que tu peux te faire serrer demain et rien ne vaut le sentiment de vivre sereinement la vie nest quune escale et ton corps nest quun emprunt tu te plains mais pense à la mort parce quelle est encore pire grosse galère on escaladait les grilles des immeubles afin de scaler dans les cages descalier pour dormir on était ensemble pour la mettre à lenvers dans tous les endroits pour ves qui la sécurité faut du sang froid je sais le vide que ça laisse en toi sans ma plus fidèle amie je serais sûrement sans toit calling you calling you when you feel lonely know which way to go ill be calling you ill be calling you they dont even know me but when you feel alone ill be calling you ill be calling you avec mes pèlerins on faisait quemmerder lmonde sur le chemin de lamitié jai fait de belles rencontres mais jai grandi pas besoin de talerter mman quand on part dans nos délires on a lair tellement cons jétais petit quand mes kabyles mont surnommé fennec s crew 2001 bébé à lépoque on navait pas besoin de se téléphoner pour s appeler fallait siffler en dessous des fenêtres on sdonne tellement dtrucs on est quittes langage cru quand on prend des cuites open bar on le brûle en équipe open mic on le brûle en équipe ma meilleure amie porte le voile elle est mignonne jouvre pas ma porte à nimporte qui jmen bats les roubignoles jmets tous mes potos dans mes clips même ceux qui ont des têtes de guignols on a appris à devenir des hommes ici la vie te cogne à tour de bras je me dis quil faut quon veille les uns sur les autres pendant que mes amis dorment autour de moi ill be calling you ill be calling you im calling you jai vu certains de mes reufs ne plus vouloir faire deffort et staire jai vu des vieilles branches partir et jai vu des faux rester mon reuf a fui la réalité jaimerais laider lautre jour jlai surpris en train dparler seul il ma vu et ma souri comme si drien nétait yavait personne pour aider ce frère issu de la jeunesse désœuvrée ta mère savait qutu la décevrais quand tu disais que tallais te sevrer malgré des parents pieux tu pars en vrille et tas touché le fond cest plus la prière mais ta casquette qui tfait des marques sur le front tas voulu tenlever la vie on aurait pu deviner avant dsauter par la fenêtre tavais déjà le regard dans le vide
57,english rose,across the sea by the tennessee skyline they told me id find my hopes and my dreams but i long to be in the bed of my true love back where i came from shes waiting for me so ill make my way through long winding country roads but my heart still beats for my home and my english rose i told my dad on the phone its amazing from the straight to the craziest places ive seen but i long to be in the arms of my true love like he loves my mother he understands me i spend my days just traveling and playing shows but my heart still beats for my home and my english rose i met a man in the bar down in memphis he told me he went there to follow his dreams he told me son you know i lost my true love for the same exact reason that you crossed the sea and i found truth in people i barely know but my heart still beats for my home and my english rose oh my heart still beats for my home and my english rose oh my heart still beats for my home and my english rose
58,even my dad does sometimes,its alright to cry even my dad does sometimes so dont wipe your eyes tears remind you youre alive its alright to die cause deaths the only thing you havent tried but just for tonight hold on so live life like youre giving up cause you act like you are go ahead and just live it up go on and tear me apart its alright to shake even my hand does sometimes so inside well rage against the dying of the light its alright to say that deaths the only thing you havent tried but just for today hold on so live life like you re giving up cause you act like you are go ahead and just live it up go on and tear me apart and hold on so live life like youre giving up cause you act like you are go ahead and just live it up go on and tear me apart and hold on
59,take it back,im not a rapper im a singer with a flow ive got a habit for spitting quicker lyrics you know youll find me ripping the writtens out of the pages they sit in i never want to get bitten cause plagiarism is hidden watch how i sit on the rhythm prisoner with the vision signed to a label but didnt listen to any criticism thought you knew but you didnt so perk your ears up and listen studio is a system and you could say that im driven and now its onto the next saga we drink the best lager ill never try to win you over like your stepfather ill do my own thing now and get respect after and im avoiding the caine like it was get carter for four years i never had a place to stay but its safe to say that it kept me grounded like a paperweight at 16 years old yeah i moved out of my home i was macy gray i tried to say goodbye and i choked and went from sleeping at a subway station to sleeping with a movie star and adding to the population not my imagination i dont wanna relax would it hurt your reputation if i put it on wax ill take it back now mmm come on and take it back love come on and take it back for us dont you fade into the back love no i take it back with the rhythm and blues with my rap pack ill be singing the news tryna act like jack black when i bring it to school ill make a beat with my feet by just hitting a loop bringing the lyrics to prove that i can fit in these shoes ill give you the truth through the vocal booth and stars burst out on the scene like an opal fruit they try to take aim like beckham when he goes to shoot but then again thats what theyre supposed to do and im supposed to be calm i tattooed the lyrics onto my arm whispering everything that happens is from now on ill be ready to start again by the end of the song and still theyre claiming that i handle it wrong but then ive never had an enemy except the nme but ill be selling twice as many copies as their magazinesll ever be with only spectacles ahead of me and festival fees are healthier than a dalmatian on pedigree singing for the masses rubber dinghy rapids i keep this rapping a habit and keep on fashioning magic im battling for respect and i dont know if ill have it this songs from the heart covered the planet ill take it back now mmm come on and take it back love come on and take it back for us dont you fade into the back love no ill take it back now now i dont ever wanna be perfect cause im a singer that you never wanna see shirtless and i accept the fact that someones gotta win worst dressed taking my first steps into the scene giving me focus putting on a brave face like timothy dalton considering a name change thinking it was hopeless rhyming over recordings avoiding tradition cause every day some lyrics and a melody could be written now absence can make your heart ache but drinking absinthe can change your mind state vividly need to let my liver be and ill say it again living life on the edge with a closed handful of friends its good advice from the man who took his life on the road with me and i hope to see him blowing up globally cause thats how its supposed to be im screaming out vocally it might seem totally impossible achieving lifes dreams but but i just write schemes im never having a stylist giving me tight jeans madison square garden is where i might be but more likely youll find me in the back room of a dive bar with my mates having a pint with mcdaid discussing records we made and every single second knowing that well never betray the way we were raised remembering our background sat down thats how we plan it out its time to take it back now mmm come on and take it back love come on and take it back for us dont you fade into the back love no mmm come on and take it back love come on and take it back for us dont you fade into the back love no my dreams keep me awake at night written in rhyme till i deliver the hype am i just living a lie with this you must know that the numbers just sold will keep me going through the tough times dream with me we forget 90 percent of it when we wake but the other 10 percent it never fades dreaming dreams of day to day goals stay awake loads tried to make the cut like the paper with a razor blade oh never give up just remember just to hold out more a couple years ago i couldnt just control that thought youd find me busking on the street when it was cold outdoors now im sweating on the stage of a sold out tour writing love songs for the sake of it never to make a hit you cant fake talent and work ethic just to make it quick im not a rapper im a singer i just take the piss and most of these other guys are kids that pose his little sister has to babysit thats just the way it is dreams are your own just set your goals and have the upmost faith in it tread your own path youll never make it as a follower youll never know where you will go or you will be tomorrow igh
60,shirtsleeves,i can taste salt water and if i blink again you ll be sinking in so well learn to swim in the oceans you made ill hold ya and you think of him and pretty soon you ll be floating away and i ll hold on to the words you spoke of anchored down in my throat love and i m captain of the sinking boat now with just one armband to carry me home when salted tears won t dry i ll wipe my shirtsleeves under your eyes these hearts will be flooded tonight i ll wipe my shirtsleeves under your eyes your eyes your eyes your eyes i still taste salt water on my lips from your kiss of bitterness and ill drown within the oceans you made and i hate to love you these cuffs are covered in your make up i ll never trust you again you can just be a friend and i ll hold on to the words you spoke of anchored down in my throat love and i m captain of the sinking boat now with just one armband to carry me home when salted tears won t dry i ll wipe my shirtsleeves under your eyes these hearts will be flooded tonight i ll wipe my shirtsleeves under your eyes your eyes your lips your mouth your thighs your back you drive me wild tonight the fact is i i m on my way home on the way home i lied i tried to cry but i m i m drowning in the oceans you made when salted tears won t dry i ll wipe my shirtsleeves under your eyes these hearts will be flooded tonight i ll wipe my shirtsleeves under your eyes your eyes your eyes your eyes
