,song_title,lyrics
24,radio,hi my name is jme there was a time when radio played me cause my music came from my heart it was real to me but now its a par im here struggling keeping it real while the rest of them are hustling seeking a deal sometimes i sit back and think jme just do one tune make a couple gs and chill the reason i started making music is the exact same reason that ill never do it i swear i didnt go through all of that for this ill give that a miss thats just how it is im fair straight who can tell me different look at me determined man on a mission my music is me and i am my music so like it or lump it imma do this i never had a playlist in my heart now i need an a list just to chart but ive been famous from the start how am i gonna make my mark are you gonna play me though this song was never meant for the radio how much will you pay me though if this songs not a hit on the radio oh oh oh oh oh oh thank god for night clubs and the raves cause i dont think they like us on the airwaves unless we water it down but cordial music is boring me now i swear i guess it matters what your goal is or in this music scene what your role is im still trying here cause im a pioneer i use my mouth less than i use my eyes and ears see im just telling you the truth cant shoot the messenger bulletproof booth you wont hear me on the radio but go to the rave and the crowd theyre raising roof why is that whats going on there to tell you the truth i dont really care i am my music my music is me like it or not this is how its gonna be i never had a playlist in my heart now i need an a list just to chart but ive been famous from the start how am i gonna make my mark are you gonna play me though this song was never meant for the radio how much will you pay me though if this songs not a hit on the radio oh oh oh oh oh oh i feel it on the airwave spinning on the dial bleeding through the speakers written by the pile so wont you hear me out never feel it from the bass line feel it in the club maybe i could take time singing for the dub so wont you hear me out i never had a playlist in my heart now i need an a list just to chart but ive been famous from the start how am i gonna make my mark are you gonna play me though this song was never meant for the radio how much will you pay me though if this songs not a hit on the radio oh oh oh oh oh oh are you gonna play me though this song was never meant for the radio how much will you pay me though if this songs not a hit on the radio oh oh oh oh oh oh
25,you,the thoughts i have could be clear ones they can seem vivid the goals i reach are not near ones the further the limit i block her out so when im looking though my mind she aint in it can i be free for a minute can i be me for a minute the thoughts i have can be dark ones even be smart ones i know im gonna have a couple straight from the heart ones tell you what i think i will until i depart mum its you that i live for im the first and the last one to love you lots whats better than thinking about the ones you love nothing much when youre thinking about the ones you love i feel the same when im on the floor see the sun above unconditional like bills payed when ive run em up no one here to help you pay now youre gonna moan no one here to save the day now youre all alone wish i was born with a golden spoon in my mouth fact is i wasnt so im coming from a quarter zone and when the sun falls down ill be up again and never close my eyes and if the dawn might break ill see nothing when nothing when my thoughts are only you and my mind is over you my thoughts are over you and these words are all for you now for you i wanna see you happy i wanna see you smile cause youve been trespassing and you wont leave my mind now ive been thinking about this you told me say yes nan im 31 now im still saying yes nan you had to replace my mum dad two parents in one i know youre proud staring at your grandson i found a job i like got the flat the cars to buy got the quad i like and cause of you and kylie its in every single song i write had a golden life wanted people to honour mine tell em while im here cause one day im gonna die and when im gone i want my music to play and when my people listen to this track its gonna make em wanna cry i aint gonna lie i think about the scene i made i say the games better its a must now ive gotta fly my talents gonna shine real shortly fam i know it i work round the clock i dont stop at night
26,lately,i seem to find myself talking to the powers that be awaking the shade and shadowed under towering trees admiring the scene inhaling fumes of flowers that breathe jet lagged eyes are begging for an hour to sleep although my bloodshot whites and irises they never find any clock stops at times where the sun shine can blind many although my eyes are heavy they wont be closing soon cause i heard that time waits for nobody i suppose its true we make corrosive tunes with acid tabs and vocal booths to see the flashing lights at photo shoots we make our motive moves i say whatever i feel to vent a rhyme so i can still invent the lines and stay close to the friends of mine cause real recognise real is what my father says and ill be sticking to this phrase until i pass away overworking no sleep is just another way to die slow but ill just keep going strong and never let my eyes close 5 oclock with lights off interview with a vampire sleep is for the living and not a utensil that i require i swear i said that ill sleep when im dead whos on the beat upon the feature with ed its d e v to the zed over tired pale faced like michael myers bags underneath my eyes can show the baggage ive acquired and over the time within this maze i think youll find youll never find that peace of mind you seek to find until youre dying cause i got too much to stay awake for to sleep or even take four seconds out the game its time to wage war scissors grab a sword and sharpen up your hunting knives two psychopathic lyricists are driving on the hunt tonight im hailing from the essex and the east london border line villans never sleep they mastermind in all sorts of crimes be wide awake just like youre snorting lines or get left mortified like you just seen the ghost of jesus walking by i never sleep when trouble steals thoughts from a restless mind for free it could be the times im living in i never sleep when trouble steals thoughts from a restless mind for free it could be the times im living in lately i brush my teeth every night but still i wake up with a bad mouth and the background is my past and my presence will bring it back out deliver the raps how i flow i live with the rats now and those that hate me call me ron but they wont slither in too easy believe me im snake minded be within this great time be on minimum wage life is a prison escape that im in its all to do with timing not the label that you sign with then my mates are doing fine but then they never put the time in i try to hide my cold side like when i flip my pillows some of the songs i write are real because the charts are filled with si li cone im still broke without the money for a mac pro living out of three bags no talk about my cash flow opposite of sober cause i never did my homework which has got me on the sofa no degree but growing older i played a fool to catch the wise i will never tell a lie i wake dead take deep breaths try to never die two guys with the same view keep it tight like scrooge making metaphors flow and move like typhoons and tunes and if we got our eyes on you well catch you while you snooze times elapsing while youre catching zeds the masses like to move we scan the situation analyse information and then decide what probably is most practical to do driven young gentlemen ive hardly changed my bed sheets at all over the last 12 months cause i havent slept in em true im coming home the lights are on your rights are wrong so im correcting em we got the fans all like oh wow its devs and ed what less did you bloody expect from em in the end sleep deprivation might just be our detriment fighting through writers block from 9 oclock to 5 oclock and no way will i ever waste a second of the time i got i keep my pupils engaged like a classroom in holy matrimony but im only trying to stay awake i never sleep when trouble steals thoughts from a restless mind for free it could be the times im living in i never sleep when trouble steals thoughts from a restless mind for free it could be the times im living in lately i never sleep when trouble steals thoughts from a restless mind for free it could be the times im living in i never sleep when trouble steals thoughts from a restless mind for free it could be the times im living in lately
27,wake me up remix,on the last few days of la i got taken into this guys house and he was sponsored by an alcohol company quite a few actually and uh got pretty wasted umm all times and i was sitting underneath a tree with my phone just putting in lyrics bah this is how i feel bah and uh i came up with this song and it is called wake me up because i was really pissed it is quite silly bear that in mind i should ink my skin with your name and take my passport out again and just replace it see i could do without a tan on my left hand where my fourth finger meets my knuckle and i should run you a hot bath fill it up with bubbles cause maybe youre loveable maybe youre my snowflake and your eyes turn from green to gray and in the winter ill hold you in a cold place and you should never cut your hair cause i love the way you flick it off your shoulder and you will never know just how beautiful you are to me but maybe im just in love when you wake me up and would you ever feel guilty if you did the same to me could you make me a cup of tea to open my eyes in the right way and i know you love shrek because weve watched it 12 times and maybe were hoping for a fairytale too and if your dvd breaks today you shouldve got a vcr because ive never owned a blue ray true say i know ive always been shit at computer games because your brother always beats me and if i lost i go across and chuck all the controllers at the tv and then you laugh at me and be asking me if im gonna be home next week and then you lie with me till i fall asleep and flutter eyelash on my cheek between the sheets and you will never know just how beautiful you are to me but maybe im just in love when you wake me up and i think you hate the smell of smoke you always try to get me to stop but you drink as much as me and i get drunk a lot so i take you to the beach and walk along the sand and ill make you a heart pendant with a pebble held in my hand and ill carve it like this necklace so the heart falls where your chest is now a piece of me is a piece of the beach and it falls just where it needs to be and rests peacefully so you just need to breathe to feel my heart against yours now against yours now maybe im just in love when you wake me up maybe im just in love when you wake me up girl me wann fi hold yuh put me arms right around ya girl you give me the tightest love me eva get inna my life girl me just wann fi squeeze yah put me arms right around ya girl you give me the tightest love me eva get inna my life oh in my life oh oh in my life oh oh in my life ooh oh maybe im just in love when you wake me up maybe im just in love when you wake me up maybe i fell in love when you woke me up
28,family,hmm let me go to see my family please father let me go as my mother sleeps i dont know about james bond but round here nobody lives twice when youre gone youre gone without no bye cause only a judge can give you life this is my advice trust me i nearly lost my life 3 weeks after i got this ride pissed like i had way too much wine wished i didnt get one anyway i was going to the macbeth booked for a set even though i didnt have a set one skream hit the decks i was like check one put on a show but it werent my best one left it dropped off blacks at his destination then i was off to the next one 20 minutes later i was on the m1 tired but i kept on going fell asleep without even knowing no motion in my face no movement in my legs but the car still kept going woke up lorry flash panic break skid crash skidded more bang smash out cold ribs cracked ouch i was in so much pain crawled out of a mégane that now looked like a mini when i was still on the first lane baffled didnt even know my name fainted too much shock in my brain surrounded by paramedics and feds trying to get up but fainted again see i just want you to take a sec and hear me out dont think im happy cos i smile when you see me out ive had serious madnesses where ive nearly disappeared and im begging lord to save me and let me go to see my family and keep it inside dry eyes while my brother weeps save my soul please father let me go keep me safe as my mother sleeps eyes closed they just wouldnt open i could hear voices and my phone ringing fighting for life cant tell if im winning one of the worst situations ive been in i could hear all of the angels singing but when they stopped humming my brain turned on started running still in pain but it started numbing the stone cold comeback i made was stunning i still tried to do a few shows cos i didnt wanna tell them that i werent coming but i was left with a permanent problem nobody knows about the pain that im in ever so cunning 6 weeks later jogging and running i used the first aid kit like a drum set picked up the tools and i gave it a drumming trust me when it comes to mistakes you cant afford to let one in never done tunes for a while the pipeline was blocked so i learned and done a bit of plumbing they say tomorrow never dies but they forgot to tell you you can you can have a sicker clan than wu tang but when your times up thats it its you fam you can try beg for another sometimes ill be on my way to a show thinking i just wanna see my brother then do a u turn im gone one up to see my family and keep it inside dry eyes while my brother weeps save my soul
29,the city remix,this city never sleeps i hear the people walk by when it s late and sirens bleed through my windowsill i can t close my eyes don t control what i m into and this tower is alive the lights that blind keep me awake my hood up and lace untied sleep fills my mind don t control what i m into london calls me a stranger a traveller this is now my home my home i m burning on the back street stuck here sitting in the backseat and i m blazing on the street what i do isn t up to you and if the city never sleeps then that makes two the pavement is my friend it will take me where i need to go so i find it trips me up and puts me down this is not what i m used to and the shop across the road fulills my needs and gives me company when i need it voices speak through my walls i don t think i m gonna make it past tomorrow and london calls me a stranger a traveller this is now my home my home burning on the back street stuck here sitting in the backseat and i m blazing on the street what i do isn t up to you and if the city never sleeps then that makes two and my lungs hurt and my ears bled with the sound of the city life echoed in my head do i need this to keep me alive the traffic stops and starts but i need to move along i m from a city where the rain won t cease pollution in the air matches that on the street the black smoke gets your head into a muddle like walking into elephant syringes in the puddle like i was a country boy when i moved out grew up too fast for my family to find out now i try to stop my music running into nosedives can t resort to arrogance with white lies this city won t erase me but i can t help to see how this dark city changed me it s all the same see music is my life but now i try to fight whatever i need to hide from north south east west london s my home now knees weak but we never slow down now i start to do my music properly and stay from all the negative shit that will follow me and london calls me a stranger this is not my home home burning on the back street stuck here sitting in the backseat and i m blazing on the street what i do isn t up to you and if the city never sleeps then that makes two burning on the back street stuck here sitting in the backseat and i m blazing on the street what i do isn t up to you and if the city never sleeps then that makes two
30,you need me i dont need you remix,now im in town break it down thinking of making a new sound playing a different show every night in front of a new crowd thats new now ciao seems that life is great now see me lose focus as i sing to you loud and i cant no i won t hush ill say the words that make you blush im gonna sing this now see im true my songs are where my heart is im like glue i stick to other artists im not you now that would be disastrous let me sing and do my thing and move to greener pastures see im real i do it all its all me im not fake dont ever call me lazy i wont stay put give me the chance to be free suffolk sadly seems to sort of suffocate me cause you need me i dont need you you need me man i dont need you you need me man i dont need you you need me man i dont need you you need me man i dont need you you need me man i dont need you you need me man i dont need you you need me i sing and write my own tune and i write my own verse hell dont need another word smith to make my tune sell call yourself a singer writer youre just bluffing your names on the credits and you didnt write nothing i sing fast i know that all my shits cool i will blast and i didnt go to brit school i came fast with the way i act right i cant last if im smoking on a crack pipe and i wont be a product of my genre my mind will always be stronger than my songs are never believe the bullshit that fake guys feed to ya always read the stories that you hear on wikipedia and musically im demonstrating when i perform live feels like i am meditating times at the enterprise when some fella filmed me a young singer writer like a gabriella cilmi cause you need me man i dont need you you need me man i dont need you you need me man i dont need you you need me man i dont need you you need me man i dont need you you need me man i dont need you you need me man i dont need you you need me all i want in this cold world is to make music and use it not to abuse it and get affected infected with the whos who of music who did it who is it whos in it or what the hell does it matter chitter chatter dont matter what a yidder yidder yadder it dont matter to me all i want is a bit of dignity in me to battle this industry freely to be me in this seedy needy world can you hear me hey so i keep singing that when i first started this rapping shit i felt pressure from haters became invaded with sadists and just developed a hater radar and made for the stars kept my grind in the dark and then appeared with a remedy kicking rhymes with a melody hennesey shots and all these fools on the block who said you gotta be a gangster now to raise to the top im just a normal casual usual everyday type of guy my head in the sky ready to die ed sheeran alone star coming out here freestyling with the guitar cause ive forgotten the lyrics of this bit right here so i freestyle off the top of the bit with the you can find me in the club bottle full of bub mummy ive got the x if youre into taking drugs into having sex i aint into making love come give me a hug if youre into getting rough you can find me in the club bottle full of bubbly mummy ive got the x if youre into taking drugs into having sex i aint into making love come give me a hug if youre into getting rough my eyes are red ive been burning ive been burning my eyes are red ive been burning ive been burning my eyes are red ive been burning ive been burning on a spliff off your high grade my eyes are red ive been burning ive been burning burning burning now where i come from burning weed it is a habit a big fat bag of high grade weed you know i got to have it cos if i dont have it in my pocket im going to panic cos like i said where i come from weed smoking is a habit yup well do da bun in the place up in the hood one of them things i have inherited like a ghetto man should one of them things is smoking weed it yes it makes me feel good burning high grade sensimilla yes it makes me feel but me is a man ah talk about sensimilla is a drug and if i start to smoke it imma nna turn into a thug where i come from that they talking could that only get you mugged where i come from burning weed it is a blessing from above where i come from yes we bun it when we listen rub a dub where i come from yes we bun after we just a make a love where i come from yes we bun it when the sun starts shine i blaze high grade weed all the time now my eyes are red now my eyes are red cause you need me i dont need you you need me man my eyes are red you need me man i dont need you you need me man my eyes are red and you need me i dont need you you need me man my eyes are red you need me man i dont need you you need me man i dont need you okay so this is the breakdown bit where we get a little bit funky ugh and i forget about the whole week you forget about the whole week the whole weekend just forget about everything cause its sunday and were all gonna get drunk after this and have a very very good time and im not stressed anymore were just letting it unwind i wanna split the room in the middle here whos up for that not not not literally you dont have to literally divide its all good all good peace and love peace and love and harmony what was i gonna say this side up there are you with me this side up there are you with me everyone scream as loud as you can okay so we found out that everyones voices work this side im not gonna insult you but you are west ham okay youre west ham yeah youre west ham football club get in the geezer mode yeah this side youre millwall yeah you two you two hate each other you two are gonna beat each other at whatever you do no matter what so if i give you something to sing you have to sing louder than them if i give you something to sing you have to sing louder than them are you all up for that millwall are you ready west ham are you ready okay west ham you sing this you need me man i dont need you you need me man i dont need you you need me man i dont need you millwall you sing this my eyes are red you need me man i dont need you you need me man my eyes are red you need me man i dont need you you need me man you need me man i dont need you millwall are winning i think i seem to find myself talking to the powers that be awaking the shade and shadowed under towering trees admiring the scene inhaling fumes of flowers that breathe jet lagged eyes are begging for an hour to sleep although my bloodshot whites and irises they never find any clock stops at times where the sun shine can blind many although my eyes are heavy they wont be closing soon cause i heard that time waits for nobody i suppose its true we make corrosive tunes with acid tabs and vocal booths to see the flashing lights at photo shoots we make our motive moves i say whatever i feel to vent a rhyme so i can still invent the lines and stay close to the friends of mine cause real recognise real is what my father says and ill be sticking to this phrase until i pass away overworking no sleep is just another way to die slow but ill just keep going strong and never let my eyes close you need me man i dont need you you need me man i dont need you you need me man i dont need you i got my friend very good friend random impulse hes gonna come up and hes gonna spit a few bars on the beat everyone give it up for random impulse yo in this game i am my own damn man no restriction post or boundaries spouting heat hungry and my circle always round to eat crossing circles counting thousands at a thousand feet counting sheep and hes sound asleep summoned from the deep now i float to sink my boat youll need a thousand fleets walk on any beat and stomp it like a thousand feet talk is cheap so i could treat you to my words for free now that im out man i aint playing like i hurt my knee its common courtesy i left you for a minute now im back and packing punches like im popeye popping spinach eating every course lunch i aint forgotten dinners play guitars as well as bars so you aint rocking with beginners sorry times ticking i cant mess with up and comers national lottery business only winners have my numbers man im nothing like you fronters show you how it is i cant really do nothing for you less you got something to give ed cause you need me i dont need you you need me man my eyes are red you need me man i dont need you you need me man my eyes are red and you need me i dont need you you need me man my eyes are red you need me man i dont need you you need me ill keep my last name forever keep the genre pretty basic gonna be breaking into other peoples tunes when i chase it and replace it with the elephant in the room with a facelift into another rappers shoes using new laces selling cds from my rucksack aiming for the papers selling cds from my rucksack aiming for the majors nationwide tour with just jack still had to get the bus back clean cut kid without a razor for the mustache i hit back when the pen hurts me im still a choir boy in a fenchurch tee im still the same as a year ago but more people hear me though according to the myspace and youtube videos im always doing shows if im not im in the studio truly broke never growing up call me ruffio melody music maker reading all the papers they say im up and coming like im fucking in an elevator later thank you thank you so much see you soon
